{"version":"flowguard.workflow/v1","context_digest":"sha256:efd7cded5bedf6ff79dd302642d5446e3ca717faba0faea84a0a1d5c2c643669","baseline_digest":"sha256:bcac339f42b51588c6cda8ac9fc41d7620954ff21d66c5b84782e77245d3ffcf","graph_digest":"sha256:46e96c8377e545e681d8c3567feb38bb7eb98dbbfec745451bbea45a29554dbd","obligations":[{"stage_id":"release","guard":"ArchGuard","coverage":["cargo.declarations","cargo.member:sha256:73bcb83570cf06fc55dbd1a94f69a3a969e38bd19aeef5aa72c2748891dd425f","cargo.member:sha256:ff4f78e38f37b98341c5ede48a3db790dbd0b2c8b86697d00e0632c2d775d49b","cargo.profile:sha256:66a7c5520441dbdf0e198ea304eda3e3308df002f572069e0a112811057d09f0","cargo.relation:sha256:c2a0b72a30d819c4cd2a9024a1a2cbf961f4de56f241300dd164c1b6fa38d43d"],"rules_digest":"sha256:07d1283488a1186919e29cdfcd12c13706a239734e4c408ecbbb12b9f9d0fff1","analyzer_version":"0.1.0"},{"stage_id":"release","guard":"GitGuard","coverage":["git.scope:fa39a90f374962fba9d2019bbb402e425225ad82c118403b505c5d25a6579c99","git.source-clean","git.submodule-contents"],"rules_digest":"sha256:a18057fde23d3735957b0c3f49f2c4dc64c6c5620b1967d3345c11dbf4502f65","analyzer_version":"1"},{"stage_id":"release","guard":"TestGuard","coverage":["testguard:test-environment:6f366e5f15849a2259d2c74f6e0362fa01aa7eec68b0637d35953f1fdca27913"],"rules_digest":"sha256:bce257d182adc1326bd898e2b9d6cd36d9646687e88ab3516b294445b9d08097","analyzer_version":"testguard.engine-map/v1"},{"stage_id":"release","guard":"codeguard","coverage":["python/ruff-f401/69a10eb07bb32af5351810e9882b0e8c6a836aa69153745d24f9842c9aa49740"],"rules_digest":"sha256:e81dcbd8d3d6e36e6147419019212a19f636a48777f1cad6d51967d457c81f3e","analyzer_version":"0.1.0"}],"missing_stages":[],"digest":"sha256:75ccb3c0387296fee303d31ee023266b2ee1df3b0cf41132d6b8c4d91d7763dc"}