{"version":"flowguard.workflow/v1","context_digest":"sha256:ab04c9ce7dc1b6711e5dc5c83c6f74aea334ddcfe9ae7ec8f010b5899754f15b","baseline_digest":"sha256:6230eb8e0eb0a06b035f26e412c5c897572c305dd16ff36c79cc4edf88dc75d7","graph_digest":"sha256:714475729b96c5b03b564f8c10521ed011467ffc24f94fbd59c8bedd3129fb49","obligations":[{"stage_id":"A/01","guard":"specguard","coverage":["A"],"rules_digest":"sha256:51ee0191b1116347cbe48cc8eb18ea1b63c538b197066d7364a62dab15ec4af9","analyzer_version":"1"}],"missing_stages":[],"digest":"sha256:749e304af3bd07a158b98f721b337efbff05d78cd5f7e22462c46376436af701"}